{
  "checks": [
    {
      "details": [],
      "name": "schema",
      "passed": true,
      "violations": 0
    },
    {
      "details": [],
      "name": "type",
      "passed": true,
      "violations": 0
    },
    {
      "details": [],
      "name": "date",
      "passed": true,
      "violations": 0
    },
    {
      "details": [],
      "name": "unit",
      "passed": true,
      "violations": 0
    },
    {
      "details": [],
      "name": "entity",
      "passed": true,
      "violations": 0
    },
    {
      "details": [],
      "name": "duplicate",
      "passed": true,
      "violations": 0
    },
    {
      "details": [],
      "name": "range",
      "passed": true,
      "violations": 0
    },
    {
      "details": [],
      "name": "source",
      "passed": true,
      "violations": 0
    },
    {
      "details": [],
      "name": "temporal",
      "passed": true,
      "violations": 0
    },
    {
      "details": [],
      "name": "ranking",
      "passed": true,
      "violations": 0
    },
    {
      "details": [],
      "name": "rank-as-value",
      "passed": true,
      "violations": 0
    },
    {
      "details": [],
      "name": "citation",
      "passed": true,
      "violations": 0
    }
  ],
  "entities": 1317,
  "generatedAt": "2026-09-30T20:37:43.517599463+00:00",
  "observations": 3203,
  "passed": true,
  "violations": 0
}